{
  "schema_version": "1.0.0",
  "generated_at": "2025-08-24T13:30:00Z",
  "publisher": { "name": "Example Publisher", "url": "https://example.com" },
  "items": [
    {
      "url": "https://example.com/blog/llm-pages-blueprint",
      "type": "article",
      "href": "https://example.com/blog/llm-pages-blueprint.llm.json"
    },
    {
      "url": "https://example.com/store/sku-ABC123",
      "type": "product",
      "href": "https://example.com/store/sku-ABC123.llm.json"
    }
  ]
}

